13:45:51.113997 IP wb-in-f189.1e100.net.https > 192.168.0.101.57673: UDP, length 31
13:45:51.475555 IP 192.168.0.1.48451 > 255.255.255.255.7437: UDP, length 173
13:45:51.827446 IP 192.168.0.101.37378 > 192.168.0.1.domain: 41942+ A? i1.ytimg.com. (30)
13:45:51.835403 IP 192.168.0.1.domain > 192.168.0.101.37378: 41942 2/4/4 CNAME ytimg.l.google.com., A 216.58.212.46 (211)
13:45:51.843468 IP 192.168.0.101.56847 > sof02s18-in-f14.1e100.net.https: UDP, length 1350
13:45:51.843918 IP 192.168.0.101.56847 > sof02s18-in-f14.1e100.net.https: UDP, length 261
13:45:51.854548 IP 192.168.0.101.49697 > sof02s17-in-f14.1e100.net.https: UDP, length 468
13:45:51.855070 IP 192.168.0.101.49697 > sof02s17-in-f14.1e100.net.https: UDP, length 546
13:45:51.859413 IP 192.168.0.101.56847 > sof02s18-in-f14.1e100.net.https: UDP, length 1350
13:45:51.862329 IP sof02s18-in-f14.1e100.net.https > 192.168.0.101.56847: UDP, length 1350
13:45:51.888001 IP 192.168.0.101.56847 > sof02s18-in-f14.1e100.net.https: UDP, length 35
13:45:51.892114 IP sof02s18-in-f14.1e100.net.https > 192.168.0.101.56847: UDP, length 30
13:45:51.892131 IP sof02s18-in-f14.1e100.net.https > 192.168.0.101.56847: UDP, length 1350
13:45:51.892134 IP sof02s17-in-f14.1e100.net.https > 192.168.0.101.49697: UDP, length 33
13:45:51.911525 IP sof02s17-in-f14.1e100.net.https > 192.168.0.101.49697: UDP, length 66
13:45:51.914015 IP sof02s17-in-f14.1e100.net.https > 192.168.0.101.49697: UDP, length 43
13:45:51.914344 IP 192.168.0.101.49697 > sof02s17-in-f14.1e100.net.https: UDP, length 41
13:45:51.917583 IP 192.168.0.101.56847 > sof02s18-in-f14.1e100.net.https: UDP, length 38
13:45:51.918909 IP sof02s18-in-f14.1e100.net.https > 192.168.0.101.56847: UDP, length 1350
13:45:51.919206 IP sof02s18-in-f14.1e100.net.https > 192.168.0.101.56847: UDP, length 1350
13:45:51.919218 IP sof02s18-in-f14.1e100.net.https > 192.168.0.101.56847: UDP, length 1350
13:45:51.919227 IP sof02s18-in-f14.1e100.net.https > 192.168.0.101.56847: UDP, length 1350
13:45:51.919379 IP 192.168.0.101.56847 > sof02s18-in-f14.1e100.net.https: UDP, length 38
13:45:51.919458 IP 192.168.0.101.56847 > sof02s18-in-f14.1e100.net.https: UDP, length 38
13:45:51.919851 IP sof02s18-in-f14.1e100.net.https > 192.168.0.101.56847: UDP, length 1350
13:45:51.919871 IP sof02s18-in-f14.1e100.net.https > 192.168.0.101.56847: UDP, length 1350
13:45:51.919881 IP sof02s18-in-f14.1e100.net.https > 192.168.0.101.56847: UDP, length 1350
13:45:51.919888 IP sof02s18-in-f14.1e100.net.https > 192.168.0.101.56847: UDP, length 1350
13:45:51.919896 IP sof02s18-in-f14.1e100.net.https > 192.168.0.101.56847: UDP, length 1350
13:45:51.919904 IP sof02s18-in-f14.1e100.net.https > 192.168.0.101.56847: UDP, length 668
13:45:51.921203 IP 192.168.0.101.56847 > sof02s18-in-f14.1e100.net.https: UDP, length 38
13:45:51.921286 IP 192.168.0.101.56847 > sof02s18-in-f14.1e100.net.https: UDP, length 38
13:45:51.921381 IP 192.168.0.101.56847 > sof02s18-in-f14.1e100.net.https: UDP, length 38
13:45:52.062384 IP 192.168.0.101.50386 > 192.168.0.1.domain: 34036+ PTR? 101.0.168.192.in-addr.arpa. (44)
13:45:52.068466 IP 192.168.0.1.domain > 192.168.0.101.50386: 34036 NXDomain 0/1/0 (93)
13:45:52.068764 IP 192.168.0.101.54206 > 192.168.0.1.domain: 2112+ PTR? 189.1.102.66.in-addr.arpa. (43)
13:45:52.075103 IP 192.168.0.1.domain > 192.168.0.101.54206: 2112 1/6/12 PTR wb-in-f189.1e100.net. (453)
13:45:52.075445 IP 192.168.0.101.53016 > 192.168.0.1.domain: 26678+ PTR? 255.255.255.255.in-addr.arpa. (46)
13:45:52.079744 IP 192.168.0.1.domain > 192.168.0.101.53016: 26678 NXDomain 0/1/0 (114)
13:45:52.080008 IP 192.168.0.101.46126 > 192.168.0.1.domain: 51288+ PTR? 1.0.168.192.in-addr.arpa. (42)
13:45:52.085665 IP 192.168.0.1.domain > 192.168.0.101.46126: 51288 NXDomain 0/1/0 (91)
13:45:52.085954 IP 192.168.0.101.34073 > 192.168.0.1.domain: 6169+ PTR? 46.212.58.216.in-addr.arpa. (44)
13:45:52.094783 IP 192.168.0.1.domain > 192.168.0.101.34073: 6169 2/6/12 PTR sof02s18-in-f14.1e100.net., PTR sof02s18-in-f46.1e100.net. (489)
13:45:52.095039 IP 192.168.0.101.43789 > 192.168.0.1.domain: 27818+ PTR? 14.212.58.216.in-addr.arpa. (44)
13:45:52.101331 IP 192.168.0.1.domain > 192.168.0.101.43789: 27818 1/6/12 PTR sof02s17-in-f14.1e100.net. (459)
13:45:53.518106 IP 192.168.0.101.51890 > sof02s18-in-f14.1e100.net.https: UDP, length 380
13:45:53.549316 IP sof02s18-in-f14.1e100.net.https > 192.168.0.101.51890: UDP, length 30
13:45:53.642892 IP sof02s18-in-f14.1e100.net.https > 192.168.0.101.51890: UDP, length 1350
13:45:53.645644 IP sof02s18-in-f14.1e100.net.https > 192.168.0.101.51890: UDP, length 1350
13:45:53.645669 IP sof02s18-in-f14.1e100.net.https > 192.168.0.101.51890: UDP, length 133
13:45:53.645908 IP 192.168.0.101.51890 > sof02s18-in-f14.1e100.net.https: UDP, length 41
13:45:53.671860 IP 192.168.0.101.51890 > sof02s18-in-f14.1e100.net.https: UDP, length 35
13:45:54.547659 IP 192.168.0.1.48451 > 255.255.255.255.7437: UDP, length 173
13:45:55.577581 IP 192.168.0.101.52034 > sof02s18-in-f14.1e100.net.https: Flags [.], ack 3820775504, win 237, options [nop,nop,TS val 4926016 ecr 312686344], length 0
13:45:55.597336 IP sof02s18-in-f14.1e100.net.https > 192.168.0.101.52034: Flags [.], ack 1, win 358, options [nop,nop,TS val 312731368 ecr 4914749], length 0
13:45:56.729574 IP 192.168.0.101.52030 > sof02s18-in-f14.1e100.net.https: Flags [.], ack 565629174, win 237, options [nop,nop,TS val 4926304 ecr 126223640], length 0
13:45:56.749354 IP sof02s18-in-f14.1e100.net.https > 192.168.0.101.52030: Flags [.], ack 1, win 350, options [nop,nop,TS val 126268696 ecr 4892519], length 0
13:45:57.518742 IP 192.168.0.1.48451 > 255.255.255.255.7437: UDP, length 173
13:45:59.517677 IP 192.168.0.101.35310 > 149.154.167.91.https: Flags [P.], seq 285185470:285185543, ack 332117345, win 229, options [nop,nop,TS val 4927001 ecr 377494978], length 73
13:45:59.567498 IP 149.154.167.91.https > 192.168.0.101.35310: Flags [P.], seq 1:90, ack 73, win 2555, options [nop,nop,TS val 377506227 ecr 4927001], length 89
13:45:59.567537 IP 192.168.0.101.35310 > 149.154.167.91.https: Flags [.], ack 90, win 229, options [nop,nop,TS val 4927013 ecr 377506227], length 0
13:45:59.673593 IP 192.168.0.101.52012 > sof02s18-in-f14.1e100.net.https: Flags [.], ack 314643469, win 237, options [nop,nop,TS val 4927040 ecr 3090212194], length 0
13:45:59.696235 IP sof02s18-in-f14.1e100.net.https > 192.168.0.101.52012: Flags [.], ack 1, win 341, options [nop,nop,TS val 3090257251 ecr 4870723], length 0
13:45:59.980279 IP wb-in-f189.1e100.net.https > 192.168.0.101.57673: UDP, length 40
13:46:00.006172 IP 192.168.0.101.57673 > wb-in-f189.1e100.net.https: UDP, length 39
13:46:00.061797 IP 192.168.0.101.55577 > 192.168.0.1.domain: 55455+ PTR? 91.167.154.149.in-addr.arpa. (45)
13:46:00.067266 IP 192.168.0.1.domain > 192.168.0.101.55577: 55455 NXDomain 0/1/0 (111)
13:46:00.589482 IP 192.168.0.1.48451 > 255.255.255.255.7437: UDP, length 173
13:46:01.519311 IP 192.168.0.101.49697 > sof02s17-in-f14.1e100.net.https: UDP, length 473
13:46:01.552593 IP sof02s17-in-f14.1e100.net.https > 192.168.0.101.49697: UDP, length 30
13:46:01.579107 IP sof02s17-in-f14.1e100.net.https > 192.168.0.101.49697: UDP, length 66
13:46:01.605032 IP 192.168.0.101.49697 > sof02s17-in-f14.1e100.net.https: UDP, length 38
13:46:02.520295 IP 192.168.0.101.51890 > sof02s18-in-f14.1e100.net.https: UDP, length 329
13:46:02.524537 IP 192.168.0.101.41327 > sof01s12-in-f2.1e100.net.https: UDP, length 1350
13:46:02.524754 IP 192.168.0.101.43101 > 192.168.0.1.domain: 46458+ A? i.ytimg.com. (29)
13:46:02.524807 IP 192.168.0.101.49352 > 192.168.0.1.domain: 18734+ A? pagead2.googlesyndication.com. (47)
13:46:02.524822 IP 192.168.0.101.40262 > 192.168.0.1.domain: 22813+ A? r3---sn-hvcpauxa-nv4s.googlevideo.com. (55)
13:46:02.524889 IP 192.168.0.101.49994 > 192.168.0.1.domain: 58116+ A? r9---sn-4g57knez.googlevideo.com. (50)
13:46:02.524940 IP 192.168.0.101.39826 > 192.168.0.1.domain: 60258+ A? r3---sn-5hne6nez.googlevideo.com. (50)
13:46:02.531192 IP 192.168.0.1.domain > 192.168.0.101.43101: 46458 2/4/4 CNAME ytimg.l.google.com., A 216.58.212.46 (210)
13:46:02.531415 IP 192.168.0.101.56705 > 192.168.0.1.domain: 34567+ A? s.youtube.com. (31)
13:46:02.531617 IP 192.168.0.1.domain > 192.168.0.101.40262: 22813 2/13/10 CNAME r3.sn-hvcpauxa-nv4s.googlevideo.com., A 82.147.133.142 (501)
13:46:02.531625 IP 192.168.0.1.domain > 192.168.0.101.49352: 18734 2/4/4 CNAME pagead46.l.doubleclick.net., A 216.58.212.34 (246)
13:46:02.531630 IP 192.168.0.1.domain > 192.168.0.101.39826: 60258 2/13/11 CNAME r3.sn-5hne6nez.googlevideo.com., A 173.194.153.232 (507)
13:46:02.531635 IP 192.168.0.1.domain > 192.168.0.101.49994: 58116 2/13/11 CNAME r9.sn-4g57knez.googlevideo.com., A 173.194.6.174 (507)
13:46:02.532741 IP 192.168.0.101.55104 > 82.147.133.142.https: UDP, length 1350
13:46:02.533728 IP 192.168.0.101.40295 > 173.194.153.232.https: UDP, length 1350
13:46:02.536374 IP sof01s12-in-f2.1e100.net.https > 192.168.0.101.41327: UDP, length 1350
13:46:02.537514 IP 192.168.0.1.domain > 192.168.0.101.56705: 34567 2/4/4 CNAME video-stats.l.google.com., A 216.58.212.14 (218)
13:46:02.548569 IP 192.168.0.101.55104 > 82.147.133.142.https: UDP, length 1350
13:46:02.550510 IP 82.147.133.142.https > 192.168.0.101.55104: UDP, length 1350
13:46:02.552912 IP 82.147.133.142.https > 192.168.0.101.55104: UDP, length 1350
13:46:02.552918 IP sof01s12-in-f2.1e100.net.https > 192.168.0.101.41327: UDP, length 1350
13:46:02.552921 IP sof02s18-in-f14.1e100.net.https > 192.168.0.101.51890: UDP, length 33
13:46:02.553883 IP 192.168.0.101.55104 > 82.147.133.142.https: UDP, length 1350
13:46:02.553943 IP 192.168.0.101.41327 > sof01s12-in-f2.1e100.net.https: UDP, length 38
13:46:02.555681 IP 82.147.133.142.https > 192.168.0.101.55104: UDP, length 38
13:46:02.556430 IP sof01s12-in-f2.1e100.net.https > 192.168.0.101.41327: UDP, length 27
13:46:02.562624 IP 82.147.133.142.https > 192.168.0.101.55104: UDP, length 1350
13:46:02.562978 IP 192.168.0.101.55104 > 82.147.133.142.https: UDP, length 41
13:46:02.596096 IP 192.168.0.101.40295 > 173.194.153.232.https: UDP, length 1350
13:46:02.603120 IP 82.147.133.142.https > 192.168.0.101.55104: UDP, length 30
13:46:02.603153 IP 173.194.153.232.https > 192.168.0.101.40295: UDP, length 1350
13:46:02.608283 IP 173.194.153.232.https > 192.168.0.101.40295: UDP, length 27
13:46:02.629681 IP 192.168.0.101.40295 > 173.194.153.232.https: UDP, length 38
13:46:02.638166 IP sof02s18-in-f14.1e100.net.https > 192.168.0.101.51890: UDP, length 408
13:46:02.638197 IP sof02s18-in-f14.1e100.net.https > 192.168.0.101.51890: UDP, length 751
13:46:02.638583 IP 192.168.0.101.51890 > sof02s18-in-f14.1e100.net.https: UDP, length 41
13:46:02.647657 IP 173.194.153.232.https > 192.168.0.101.40295: UDP, length 1350
13:46:02.673353 IP 192.168.0.101.40295 > 173.194.153.232.https: UDP, length 35
13:46:02.683876 IP 192.168.0.101.49697 > sof02s17-in-f14.1e100.net.https: UDP, length 507
13:46:02.684010 IP 192.168.0.101.49697 > sof02s17-in-f14.1e100.net.https: UDP, length 534
13:46:02.684816 IP 192.168.0.101.41875 > 192.168.0.1.domain: 47424+ A? r1---sn-hvcpauxa-nv4s.googlevideo.com. (55)
13:46:02.689089 IP 192.168.0.1.domain > 192.168.0.101.41875: 47424 2/13/10 CNAME r1.sn-hvcpauxa-nv4s.googlevideo.com., A 82.147.133.140 (501)
13:46:02.689101 IP sof02s17-in-f14.1e100.net.https > 192.168.0.101.49697: UDP, length 33
13:46:02.689915 IP 192.168.0.101.34544 > 82.147.133.140.https: UDP, length 1350
13:46:02.690062 IP 192.168.0.101.34544 > 82.147.133.140.https: UDP, length 264
13:46:02.690333 IP 192.168.0.101.50468 > 82.147.133.140.https: Flags [S], seq 966747317, win 29200, options [mss 1460,sackOK,TS val 4927794 ecr 0,nop,wscale 7], length 0
13:46:02.698717 IP 82.147.133.140.https > 192.168.0.101.50468: Flags [S.], seq 4179914683, ack 966747318, win 28960, options [mss 1460,sackOK,TS val 556661222 ecr 4927794,nop,wscale 7], length 0
13:46:02.698742 IP 192.168.0.101.50468 > 82.147.133.140.https: Flags [.], ack 1, win 229, options [nop,nop,TS val 4927796 ecr 556661222], length 0
13:46:02.698756 IP 82.147.133.140.https > 192.168.0.101.34544: UDP, length 1350
13:46:02.698760 IP 82.147.133.140.https > 192.168.0.101.34544: UDP, length 27
13:46:02.698762 IP 82.147.133.140.https > 192.168.0.101.34544: UDP, length 70
13:46:02.699147 IP 192.168.0.101.34544 > 82.147.133.140.https: UDP, length 41
13:46:02.699262 IP 192.168.0.101.50468 > 82.147.133.140.https: Flags [P.], seq 1:518, ack 1, win 229, options [nop,nop,TS val 4927796 ecr 556661222], length 517
13:46:02.703767 IP 82.147.133.140.https > 192.168.0.101.50468: Flags [.], ack 518, win 235, options [nop,nop,TS val 556661232 ecr 4927796], length 0
13:46:02.706011 IP 82.147.133.140.https > 192.168.0.101.50468: Flags [P.], seq 1:148, ack 518, win 235, options [nop,nop,TS val 556661232 ecr 4927796], length 147
13:46:02.706024 IP 192.168.0.101.50468 > 82.147.133.140.https: Flags [.], ack 148, win 237, options [nop,nop,TS val 4927798 ecr 556661232], length 0
13:46:02.706183 IP 192.168.0.101.50468 > 82.147.133.140.https: Flags [P.], seq 518:569, ack 148, win 237, options [nop,nop,TS val 4927798 ecr 556661232], length 51
13:46:02.733191 IP sof02s17-in-f14.1e100.net.https > 192.168.0.101.49697: UDP, length 66
13:46:02.733212 IP sof02s17-in-f14.1e100.net.https > 192.168.0.101.49697: UDP, length 43
13:46:02.733622 IP 192.168.0.101.49697 > sof02s17-in-f14.1e100.net.https: UDP, length 41
13:46:02.765517 IP 82.147.133.140.https > 192.168.0.101.50468: Flags [.], ack 569, win 235, options [nop,nop,TS val 556661278 ecr 4927798], length 0
13:46:02.814219 IP sof02s18-in-f14.1e100.net.https > 192.168.0.101.51890: UDP, length 1350
13:46:02.814255 IP sof02s18-in-f14.1e100.net.https > 192.168.0.101.51890: UDP, length 1350
13:46:02.814273 IP sof02s18-in-f14.1e100.net.https > 192.168.0.101.51890: UDP, length 1350
13:46:02.814281 IP sof02s18-in-f14.1e100.net.https > 192.168.0.101.51890: UDP, length 1350
13:46:02.814536 IP 192.168.0.101.51890 > sof02s18-in-f14.1e100.net.https: UDP, length 38
13:46:02.814634 IP 192.168.0.101.51890 > sof02s18-in-f14.1e100.net.https: UDP, length 38
13:46:02.814828 IP sof02s18-in-f14.1e100.net.https > 192.168.0.101.51890: UDP, length 1350
13:46:02.814854 IP sof02s18-in-f14.1e100.net.https > 192.168.0.101.51890: UDP, length 1350
13:46:02.814865 IP sof02s18-in-f14.1e100.net.https > 192.168.0.101.51890: UDP, length 1350
13:46:02.814872 IP sof02s18-in-f14.1e100.net.https > 192.168.0.101.51890: UDP, length 1350
13:46:02.815291 IP sof02s18-in-f14.1e100.net.https > 192.168.0.101.51890: UDP, length 1350
13:46:02.815311 IP sof02s18-in-f14.1e100.net.https > 192.168.0.101.51890: UDP, length 140
13:46:02.815348 IP 192.168.0.101.51890 > sof02s18-in-f14.1e100.net.https: UDP, length 38
13:46:02.815416 IP 192.168.0.101.51890 > sof02s18-in-f14.1e100.net.https: UDP, length 38
13:46:02.815463 IP 192.168.0.101.51890 > sof02s18-in-f14.1e100.net.https: UDP, length 38
13:46:02.891248 IP 192.168.0.101.34544 > 82.147.133.140.https: UDP, length 620
13:46:02.892332 IP 192.168.0.101.34544 > 82.147.133.140.https: UDP, length 591
13:46:02.899713 IP 82.147.133.140.https > 192.168.0.101.34544: UDP, length 33
13:46:02.907636 IP 192.168.0.101.33444 > 192.168.0.1.domain: 35191+ A? ad.doubleclick.net. (36)
13:46:02.911455 IP 192.168.0.1.domain > 192.168.0.101.33444: 35191 2/4/4 CNAME dart.l.doubleclick.net., A 216.58.212.38 (219)
13:46:02.913340 IP 192.168.0.101.51890 > sof02s18-in-f14.1e100.net.https: UDP, length 226
13:46:02.913387 IP 192.168.0.101.51890 > sof02s18-in-f14.1e100.net.https: UDP, length 24
13:46:02.915122 IP 192.168.0.101.45901 > sof02s18-in-f38.1e100.net.https: UDP, length 1350
13:46:02.915330 IP 192.168.0.101.45901 > sof02s18-in-f38.1e100.net.https: UDP, length 1350
13:46:02.915345 IP 192.168.0.101.45901 > sof02s18-in-f38.1e100.net.https: UDP, length 509
13:46:02.921727 IP sof02s18-in-f14.1e100.net.https > 192.168.0.101.51890: UDP, length 48
13:46:02.921740 IP sof02s18-in-f38.1e100.net.https > 192.168.0.101.45901: UDP, length 1350
13:46:02.922277 IP sof02s18-in-f38.1e100.net.https > 192.168.0.101.45901: UDP, length 30
13:46:02.930028 IP 82.147.133.140.https > 192.168.0.101.34544: UDP, length 1350
13:46:02.930547 IP 82.147.133.140.https > 192.168.0.101.34544: UDP, length 1350
13:46:02.930553 IP 82.147.133.140.https > 192.168.0.101.34544: UDP, length 1350
13:46:02.930555 IP 82.147.133.140.https > 192.168.0.101.34544: UDP, length 1350
13:46:02.930556 IP 82.147.133.140.https > 192.168.0.101.34544: UDP, length 1350
13:46:02.930557 IP 82.147.133.140.https > 192.168.0.101.34544: UDP, length 1350
13:46:02.930559 IP 82.147.133.140.https > 192.168.0.101.34544: UDP, length 1350
13:46:02.930561 IP 82.147.133.140.https > 192.168.0.101.34544: UDP, length 1350
13:46:02.930563 IP 82.147.133.140.https > 192.168.0.101.34544: UDP, length 1350
13:46:02.930566 IP 82.147.133.140.https > 192.168.0.101.34544: UDP, length 1350
13:46:02.930853 IP 192.168.0.101.34544 > 82.147.133.140.https: UDP, length 41
13:46:02.930887 IP 192.168.0.101.34544 > 82.147.133.140.https: UDP, length 38
13:46:02.930903 IP 192.168.0.101.34544 > 82.147.133.140.https: UDP, length 38
13:46:02.930919 IP 192.168.0.101.34544 > 82.147.133.140.https: UDP, length 38
13:46:02.930933 IP 192.168.0.101.34544 > 82.147.133.140.https: UDP, length 38
13:46:02.932682 IP 82.147.133.140.https > 192.168.0.101.34544: UDP, length 1350
13:46:02.932693 IP 82.147.133.140.https > 192.168.0.101.34544: UDP, length 1350
13:46:02.932695 IP 82.147.133.140.https > 192.168.0.101.34544: UDP, length 1350
13:46:02.932697 IP 82.147.133.140.https > 192.168.0.101.34544: UDP, length 1350
13:46:02.932700 IP 82.147.133.140.https > 192.168.0.101.34544: UDP, length 1350
13:46:02.932766 IP 82.147.133.140.https > 192.168.0.101.34544: UDP, length 1350
13:46:02.932770 IP 82.147.133.140.https > 192.168.0.101.34544: UDP, length 1350
13:46:02.932776 IP 82.147.133.140.https > 192.168.0.101.34544: UDP, length 1350
13:46:02.932779 IP 82.147.133.140.https > 192.168.0.101.34544: UDP, length 1350
13:46:02.932781 IP 82.147.133.140.https > 192.168.0.101.34544: UDP, length 1350
13:46:02.932784 IP 82.147.133.140.https > 192.168.0.101.34544: UDP, length 1350
13:46:02.932787 IP 82.147.133.140.https > 192.168.0.101.34544: UDP, length 1350
13:46:02.932789 IP 82.147.133.140.https > 192.168.0.101.34544: UDP, length 1350
13:46:02.932791 IP 82.147.133.140.https > 192.168.0.101.34544: UDP, length 1350
13:46:02.932794 IP 82.147.133.140.https > 192.168.0.101.34544: UDP, length 359
13:46:02.932794 IP 192.168.0.101.34544 > 82.147.133.140.https: UDP, length 38
13:46:02.932796 IP 82.147.133.140.https > 192.168.0.101.34544: UDP, length 1350
13:46:02.932823 IP 192.168.0.101.34544 > 82.147.133.140.https: UDP, length 38
13:46:02.932840 IP 192.168.0.101.34544 > 82.147.133.140.https: UDP, length 38
13:46:02.932854 IP 192.168.0.101.34544 > 82.147.133.140.https: UDP, length 38
13:46:02.932871 IP 192.168.0.101.34544 > 82.147.133.140.https: UDP, length 38
13:46:02.932886 IP 192.168.0.101.34544 > 82.147.133.140.https: UDP, length 38
13:46:02.932900 IP 192.168.0.101.34544 > 82.147.133.140.https: UDP, length 38
13:46:02.932916 IP 192.168.0.101.34544 > 82.147.133.140.https: UDP, length 38
13:46:02.933320 IP 82.147.133.140.https > 192.168.0.101.34544: UDP, length 1350
13:46:02.933329 IP 82.147.133.140.https > 192.168.0.101.34544: UDP, length 1350
13:46:02.933331 IP 82.147.133.140.https > 192.168.0.101.34544: UDP, length 1350
13:46:02.933334 IP 82.147.133.140.https > 192.168.0.101.34544: UDP, length 1350
13:46:02.933335 IP 82.147.133.140.https > 192.168.0.101.34544: UDP, length 1350
13:46:02.933338 IP 82.147.133.140.https > 192.168.0.101.34544: UDP, length 1350
13:46:02.933340 IP 82.147.133.140.https > 192.168.0.101.34544: UDP, length 1350
13:46:02.933344 IP 82.147.133.140.https > 192.168.0.101.34544: UDP, length 1350
13:46:02.933407 IP 192.168.0.101.34544 > 82.147.133.140.https: UDP, length 38
13:46:02.933433 IP 192.168.0.101.34544 > 82.147.133.140.https: UDP, length 38
13:46:02.933450 IP 192.168.0.101.34544 > 82.147.133.140.https: UDP, length 38
13:46:02.933472 IP 192.168.0.101.34544 > 82.147.133.140.https: UDP, length 38
13:46:02.933763 IP 82.147.133.140.https > 192.168.0.101.34544: UDP, length 1350
13:46:02.933770 IP 82.147.133.140.https > 192.168.0.101.34544: UDP, length 1350
13:46:02.933852 IP 192.168.0.101.34544 > 82.147.133.140.https: UDP, length 38
13:46:02.935991 IP sof02s18-in-f38.1e100.net.https > 192.168.0.101.45901: UDP, length 1350
13:46:02.936491 IP 192.168.0.101.45901 > sof02s18-in-f38.1e100.net.https: UDP, length 41
13:46:02.936619 IP 192.168.0.101.49697 > sof02s17-in-f14.1e100.net.https: UDP, length 585
13:46:02.937438 IP 192.168.0.101.51890 > sof02s18-in-f14.1e100.net.https: UDP, length 111
13:46:02.937465 IP 192.168.0.101.51890 > sof02s18-in-f14.1e100.net.https: UDP, length 24
13:46:02.939350 IP 82.147.133.140.https > 192.168.0.101.34544: UDP, length 1350
13:46:02.940368 IP 82.147.133.140.https > 192.168.0.101.34544: UDP, length 1350
13:46:02.940379 IP 82.147.133.140.https > 192.168.0.101.34544: UDP, length 1350
13:46:02.940380 IP 82.147.133.140.https > 192.168.0.101.34544: UDP, length 1350
13:46:02.940400 IP 82.147.133.140.https > 192.168.0.101.34544: UDP, length 1350
13:46:02.940403 IP 82.147.133.140.https > 192.168.0.101.34544: UDP, length 1350
13:46:02.940407 IP 82.147.133.140.https > 192.168.0.101.34544: UDP, length 1350
13:46:02.940409 IP 82.147.133.140.https > 192.168.0.101.34544: UDP, length 1350
13:46:02.940787 IP 192.168.0.101.49116 > sof02s18-in-f2.1e100.net.https: UDP, length 1350
13:46:02.940884 IP 192.168.0.101.34544 > 82.147.133.140.https: UDP, length 38
13:46:02.940908 IP 192.168.0.101.34544 > 82.147.133.140.https: UDP, length 38
13:46:02.940924 IP 192.168.0.101.34544 > 82.147.133.140.https: UDP, length 38
13:46:02.940940 IP 192.168.0.101.34544 > 82.147.133.140.https: UDP, length 38
13:46:02.941046 IP 192.168.0.101.49116 > sof02s18-in-f2.1e100.net.https: UDP, length 329
13:46:02.943079 IP 192.168.0.101.33210 > 192.168.0.1.domain: 40831+ A? r3---sn-q4fl6n76.googlevideo.com. (50)
13:46:02.943135 IP 82.147.133.140.https > 192.168.0.101.34544: UDP, length 1350
13:46:02.947547 IP 82.147.133.140.https > 192.168.0.101.34544: UDP, length 1350
13:46:02.947555 IP 82.147.133.140.https > 192.168.0.101.34544: UDP, length 1350
13:46:02.947557 IP 82.147.133.140.https > 192.168.0.101.34544: UDP, length 1350
13:46:02.947560 IP 82.147.133.140.https > 192.168.0.101.34544: UDP, length 1350
13:46:02.947561 IP 82.147.133.140.https > 192.168.0.101.34544: UDP, length 1350
13:46:02.947562 IP 82.147.133.140.https > 192.168.0.101.34544: UDP, length 392
13:46:02.947563 IP sof02s18-in-f14.1e100.net.https > 192.168.0.101.51890: UDP, length 30
13:46:02.947565 IP sof02s18-in-f38.1e100.net.https > 192.168.0.101.45901: UDP, length 30
13:46:02.947593 IP 192.168.0.101.34544 > 82.147.133.140.https: UDP, length 38
13:46:02.947618 IP 192.168.0.101.34544 > 82.147.133.140.https: UDP, length 38
13:46:02.947633 IP 192.168.0.101.34544 > 82.147.133.140.https: UDP, length 38
13:46:02.953919 IP sof02s18-in-f2.1e100.net.https > 192.168.0.101.49116: UDP, length 1350
13:46:02.956869 IP 82.147.133.140.https > 192.168.0.101.34544: UDP, length 1350
13:46:02.956876 IP 82.147.133.140.https > 192.168.0.101.34544: UDP, length 1350
13:46:02.956879 IP 82.147.133.140.https > 192.168.0.101.34544: UDP, length 1350
13:46:02.956880 IP 82.147.133.140.https > 192.168.0.101.34544: UDP, length 1350
13:46:02.956882 IP 82.147.133.140.https > 192.168.0.101.34544: UDP, length 1350
13:46:02.956884 IP 82.147.133.140.https > 192.168.0.101.34544: UDP, length 1350
13:46:02.956889 IP 82.147.133.140.https > 192.168.0.101.34544: UDP, length 1350
13:46:02.956891 IP 82.147.133.140.https > 192.168.0.101.34544: UDP, length 1350
13:46:02.956894 IP 82.147.133.140.https > 192.168.0.101.34544: UDP, length 1350
13:46:02.956896 IP 82.147.133.140.https > 192.168.0.101.34544: UDP, length 1350
13:46:02.956899 IP 82.147.133.140.https > 192.168.0.101.34544: UDP, length 1350
13:46:02.956901 IP 82.147.133.140.https > 192.168.0.101.34544: UDP, length 1350
13:46:02.956903 IP 82.147.133.140.https > 192.168.0.101.34544: UDP, length 1350
13:46:02.956904 IP 82.147.133.140.https > 192.168.0.101.34544: UDP, length 1350
13:46:02.956906 IP 82.147.133.140.https > 192.168.0.101.34544: UDP, length 1350
13:46:02.956908 IP 82.147.133.140.https > 192.168.0.101.34544: UDP, length 1350
13:46:02.956910 IP 82.147.133.140.https > 192.168.0.101.34544: UDP, length 1350
13:46:02.956912 IP 82.147.133.140.https > 192.168.0.101.34544: UDP, length 1350
13:46:02.956914 IP 82.147.133.140.https > 192.168.0.101.34544: UDP, length 1350
13:46:02.956916 IP 82.147.133.140.https > 192.168.0.101.34544: UDP, length 1350
13:46:02.956918 IP 82.147.133.140.https > 192.168.0.101.34544: UDP, length 1350
13:46:02.956920 IP 82.147.133.140.https > 192.168.0.101.34544: UDP, length 1350
13:46:02.956923 IP 82.147.133.140.https > 192.168.0.101.34544: UDP, length 1350
13:46:02.956925 IP 82.147.133.140.https > 192.168.0.101.34544: UDP, length 1350
13:46:02.956927 IP 82.147.133.140.https > 192.168.0.101.34544: UDP, length 1350
13:46:02.956929 IP 82.147.133.140.https > 192.168.0.101.34544: UDP, length 1350
13:46:02.956931 IP 82.147.133.140.https > 192.168.0.101.34544: UDP, length 1350
13:46:02.956932 IP 82.147.133.140.https > 192.168.0.101.34544: UDP, length 1350
13:46:02.956934 IP 82.147.133.140.https > 192.168.0.101.34544: UDP, length 1350
13:46:02.956936 IP 82.147.133.140.https > 192.168.0.101.34544: UDP, length 1350
13:46:02.956983 IP 82.147.133.140.https > 192.168.0.101.34544: UDP, length 1350
13:46:02.956986 IP 82.147.133.140.https > 192.168.0.101.34544: UDP, length 1350
13:46:02.957000 IP 192.168.0.101.34544 > 82.147.133.140.https: UDP, length 38
13:46:02.957035 IP 192.168.0.101.34544 > 82.147.133.140.https: UDP, length 38
13:46:02.957050 IP 192.168.0.101.34544 > 82.147.133.140.https: UDP, length 38
13:46:02.957065 IP 192.168.0.101.34544 > 82.147.133.140.https: UDP, length 38
13:46:02.957078 IP 192.168.0.101.34544 > 82.147.133.140.https: UDP, length 38
13:46:02.957092 IP 192.168.0.101.34544 > 82.147.133.140.https: UDP, length 38
13:46:02.957107 IP 192.168.0.101.34544 > 82.147.133.140.https: UDP, length 38
13:46:02.957121 IP 192.168.0.101.34544 > 82.147.133.140.https: UDP, length 38
13:46:02.957139 IP 192.168.0.101.34544 > 82.147.133.140.https: UDP, length 38
13:46:02.957157 IP 192.168.0.101.34544 > 82.147.133.140.https: UDP, length 38
13:46:02.957171 IP 192.168.0.101.34544 > 82.147.133.140.https: UDP, length 38
13:46:02.957185 IP 192.168.0.101.34544 > 82.147.133.140.https: UDP, length 38
13:46:02.957201 IP 192.168.0.101.34544 > 82.147.133.140.https: UDP, length 38
13:46:02.957215 IP 192.168.0.101.34544 > 82.147.133.140.https: UDP, length 38
13:46:02.957229 IP 192.168.0.101.34544 > 82.147.133.140.https: UDP, length 38
13:46:02.957246 IP 192.168.0.101.34544 > 82.147.133.140.https: UDP, length 38
13:46:02.957376 IP 82.147.133.140.https > 192.168.0.101.34544: UDP, length 1350
13:46:02.957379 IP 82.147.133.140.https > 192.168.0.101.34544: UDP, length 1350
13:46:02.957381 IP 82.147.133.140.https > 192.168.0.101.34544: UDP, length 1350
13:46:02.957384 IP 82.147.133.140.https > 192.168.0.101.34544: UDP, length 1350
13:46:02.957387 IP 82.147.133.140.https > 192.168.0.101.34544: UDP, length 1350
13:46:02.957390 IP 82.147.133.140.https > 192.168.0.101.34544: UDP, length 1350
13:46:02.957393 IP 82.147.133.140.https > 192.168.0.101.34544: UDP, length 1350
13:46:02.957395 IP 82.147.133.140.https > 192.168.0.101.34544: UDP, length 1350
13:46:02.957397 IP 82.147.133.140.https > 192.168.0.101.34544: UDP, length 1350
13:46:02.957919 IP 192.168.0.101.34544 > 82.147.133.140.https: UDP, length 38
13:46:02.957947 IP 192.168.0.101.34544 > 82.147.133.140.https: UDP, length 38
13:46:02.957965 IP 192.168.0.101.34544 > 82.147.133.140.https: UDP, length 38
13:46:02.957980 IP 192.168.0.101.34544 > 82.147.133.140.https: UDP, length 38
13:46:02.957995 IP 192.168.0.101.34544 > 82.147.133.140.https: UDP, length 38
13:46:02.958636 IP 82.147.133.140.https > 192.168.0.101.34544: UDP, length 1350
13:46:02.958647 IP 82.147.133.140.https > 192.168.0.101.34544: UDP, length 1350
13:46:02.958652 IP 82.147.133.140.https > 192.168.0.101.34544: UDP, length 1350
13:46:02.958654 IP 82.147.133.140.https > 192.168.0.101.34544: UDP, length 1350
13:46:02.958657 IP 82.147.133.140.https > 192.168.0.101.34544: UDP, length 1350
13:46:02.958660 IP 82.147.133.140.https > 192.168.0.101.34544: UDP, length 1350
13:46:02.958666 IP 82.147.133.140.https > 192.168.0.101.34544: UDP, length 1350
13:46:02.958669 IP 82.147.133.140.https > 192.168.0.101.34544: UDP, length 1350
13:46:02.958694 IP 82.147.133.140.https > 192.168.0.101.34544: UDP, length 1350
13:46:02.958698 IP 82.147.133.140.https > 192.168.0.101.34544: UDP, length 1350
13:46:02.958700 IP 82.147.133.140.https > 192.168.0.101.34544: UDP, length 833
13:46:02.958702 IP sof02s18-in-f2.1e100.net.https > 192.168.0.101.49116: UDP, length 30
13:46:02.958730 IP 192.168.0.101.34544 > 82.147.133.140.https: UDP, length 38
13:46:02.958771 IP 192.168.0.101.34544 > 82.147.133.140.https: UDP, length 38
13:46:02.958788 IP 192.168.0.101.34544 > 82.147.133.140.https: UDP, length 38
13:46:02.958804 IP 192.168.0.101.34544 > 82.147.133.140.https: UDP, length 38
13:46:02.958821 IP 192.168.0.101.34544 > 82.147.133.140.https: UDP, length 38
13:46:02.959659 IP 192.168.0.101.34544 > 82.147.133.140.https: UDP, length 608
13:46:02.959715 IP 192.168.0.1.domain > 192.168.0.101.33210: 40831 2/13/11 CNAME r3.sn-q4fl6n76.googlevideo.com., A 74.125.3.89 (507)
13:46:02.963082 IP 192.168.0.101.59677 > 74.125.3.89.https: UDP, length 1350
13:46:02.963175 IP sof02s18-in-f2.1e100.net.https > 192.168.0.101.49116: UDP, length 1350
13:46:02.963358 IP 192.168.0.101.49116 > sof02s18-in-f2.1e100.net.https: UDP, length 41
13:46:02.963527 IP 192.168.0.101.59677 > 74.125.3.89.https: UDP, length 531
13:46:02.972328 IP sof02s17-in-f14.1e100.net.https > 192.168.0.101.49697: UDP, length 30
13:46:02.976757 IP 82.147.133.140.https > 192.168.0.101.34544: UDP, length 90
13:46:02.983083 IP sof02s17-in-f14.1e100.net.https > 192.168.0.101.49697: UDP, length 43
13:46:02.991851 IP 82.147.133.140.https > 192.168.0.101.34544: UDP, length 1350
13:46:02.991862 IP 82.147.133.140.https > 192.168.0.101.34544: UDP, length 1350
13:46:02.991864 IP 82.147.133.140.https > 192.168.0.101.34544: UDP, length 1350
13:46:02.991866 IP 82.147.133.140.https > 192.168.0.101.34544: UDP, length 1350
13:46:02.991869 IP 82.147.133.140.https > 192.168.0.101.34544: UDP, length 1350
13:46:02.991870 IP 82.147.133.140.https > 192.168.0.101.34544: UDP, length 1350
13:46:02.991872 IP 82.147.133.140.https > 192.168.0.101.34544: UDP, length 1350
13:46:02.991874 IP 82.147.133.140.https > 192.168.0.101.34544: UDP, length 1350
13:46:02.991974 IP 82.147.133.140.https > 192.168.0.101.34544: UDP, length 1350
13:46:02.991980 IP 82.147.133.140.https > 192.168.0.101.34544: UDP, length 1350
13:46:02.991982 IP 82.147.133.140.https > 192.168.0.101.34544: UDP, length 1350
13:46:02.991983 IP 82.147.133.140.https > 192.168.0.101.34544: UDP, length 1350
13:46:02.991985 IP 82.147.133.140.https > 192.168.0.101.34544: UDP, length 1350
13:46:02.991987 IP 82.147.133.140.https > 192.168.0.101.34544: UDP, length 1350
13:46:02.991989 IP 82.147.133.140.https > 192.168.0.101.34544: UDP, length 1350
13:46:02.991991 IP 82.147.133.140.https > 192.168.0.101.34544: UDP, length 1350
13:46:02.991993 IP 82.147.133.140.https > 192.168.0.101.34544: UDP, length 1350
13:46:02.991995 IP 82.147.133.140.https > 192.168.0.101.34544: UDP, length 1350
13:46:02.992021 IP 192.168.0.101.34544 > 82.147.133.140.https: UDP, length 41
13:46:02.992048 IP 192.168.0.101.34544 > 82.147.133.140.https: UDP, length 38
13:46:02.992062 IP 192.168.0.101.34544 > 82.147.133.140.https: UDP, length 38
13:46:02.992078 IP 192.168.0.101.34544 > 82.147.133.140.https: UDP, length 38
13:46:02.992091 IP 192.168.0.101.34544 > 82.147.133.140.https: UDP, length 38
13:46:02.992106 IP 192.168.0.101.34544 > 82.147.133.140.https: UDP, length 38
13:46:02.992124 IP 192.168.0.101.34544 > 82.147.133.140.https: UDP, length 38
13:46:02.992141 IP 192.168.0.101.34544 > 82.147.133.140.https: UDP, length 38
13:46:02.992155 IP 192.168.0.101.34544 > 82.147.133.140.https: UDP, length 38
13:46:02.995102 IP 82.147.133.140.https > 192.168.0.101.34544: UDP, length 1350
13:46:02.995112 IP 82.147.133.140.https > 192.168.0.101.34544: UDP, length 1350
13:46:02.995114 IP 82.147.133.140.https > 192.168.0.101.34544: UDP, length 1350
13:46:02.995116 IP 82.147.133.140.https > 192.168.0.101.34544: UDP, length 1350
13:46:02.995120 IP 82.147.133.140.https > 192.168.0.101.34544: UDP, length 1350
13:46:02.995122 IP 82.147.133.140.https > 192.168.0.101.34544: UDP, length 1350
13:46:02.995124 IP 82.147.133.140.https > 192.168.0.101.34544: UDP, length 1350
13:46:02.995125 IP 82.147.133.140.https > 192.168.0.101.34544: UDP, length 1350
13:46:02.995129 IP sof02s18-in-f38.1e100.net.https > 192.168.0.101.45901: UDP, length 1350
13:46:02.995157 IP sof02s18-in-f38.1e100.net.https > 192.168.0.101.45901: UDP, length 1350
13:46:02.995160 IP sof02s18-in-f38.1e100.net.https > 192.168.0.101.45901: UDP, length 1350
13:46:02.995162 IP sof02s18-in-f38.1e100.net.https > 192.168.0.101.45901: UDP, length 1350
13:46:02.995164 IP sof02s18-in-f38.1e100.net.https > 192.168.0.101.45901: UDP, length 1350
13:46:02.995165 IP sof02s18-in-f38.1e100.net.https > 192.168.0.101.45901: UDP, length 97
13:46:02.995167 IP 82.147.133.140.https > 192.168.0.101.34544: UDP, length 1350
13:46:02.995171 IP 82.147.133.140.https > 192.168.0.101.34544: UDP, length 1350
13:46:02.995173 IP 82.147.133.140.https > 192.168.0.101.34544: UDP, length 1350
13:46:02.995218 IP 192.168.0.101.60814 > 192.168.0.1.domain: 41535+ PTR? 2.209.58.216.in-addr.arpa. (43)
13:46:02.995227 IP 192.168.0.101.34544 > 82.147.133.140.https: UDP, length 38
13:46:02.995246 IP 192.168.0.101.34544 > 82.147.133.140.https: UDP, length 38
13:46:02.995276 IP 192.168.0.101.34544 > 82.147.133.140.https: UDP, length 38
13:46:02.995297 IP 192.168.0.101.34544 > 82.147.133.140.https: UDP, length 38
13:46:02.995313 IP 192.168.0.101.34544 > 82.147.133.140.https: UDP, length 38
13:46:02.995430 IP 192.168.0.101.45901 > sof02s18-in-f38.1e100.net.https: UDP, length 41
13:46:02.995448 IP 192.168.0.101.45901 > sof02s18-in-f38.1e100.net.https: UDP, length 38
13:46:02.995463 IP 192.168.0.101.45901 > sof02s18-in-f38.1e100.net.https: UDP, length 38
13:46:02.996766 IP 82.147.133.140.https > 192.168.0.101.34544: UDP, length 1350
13:46:02.996776 IP 82.147.133.140.https > 192.168.0.101.34544: UDP, length 1350
13:46:02.996778 IP 82.147.133.140.https > 192.168.0.101.34544: UDP, length 1350
13:46:02.996780 IP 82.147.133.140.https > 192.168.0.101.34544: UDP, length 1350
13:46:02.996785 IP 82.147.133.140.https > 192.168.0.101.34544: UDP, length 1350
13:46:02.996787 IP 82.147.133.140.https > 192.168.0.101.34544: UDP, length 1350
13:46:02.996790 IP 82.147.133.140.https > 192.168.0.101.34544: UDP, length 1350
13:46:02.996848 IP 192.168.0.101.34544 > 82.147.133.140.https: UDP, length 38
13:46:02.996891 IP 192.168.0.101.34544 > 82.147.133.140.https: UDP, length 38
13:46:02.996916 IP 192.168.0.101.34544 > 82.147.133.140.https: UDP, length 38
13:46:02.996939 IP 192.168.0.101.34544 > 82.147.133.140.https: UDP, length 38
13:46:02.997579 IP 82.147.133.140.https > 192.168.0.101.34544: UDP, length 1350
13:46:02.997588 IP 82.147.133.140.https > 192.168.0.101.34544: UDP, length 1350
13:46:02.997591 IP 82.147.133.140.https > 192.168.0.101.34544: UDP, length 1350
13:46:02.997593 IP 82.147.133.140.https > 192.168.0.101.34544: UDP, length 1350
13:46:02.997596 IP 82.147.133.140.https > 192.168.0.101.34544: UDP, length 1350
13:46:02.997599 IP 82.147.133.140.https > 192.168.0.101.34544: UDP, length 1350
13:46:02.997601 IP sof02s18-in-f2.1e100.net.https > 192.168.0.101.49116: UDP, length 339
13:46:02.997605 IP 82.147.133.140.https > 192.168.0.101.34544: UDP, length 1350
13:46:02.997663 IP 192.168.0.101.34544 > 82.147.133.140.https: UDP, length 38
13:46:02.997702 IP 192.168.0.101.34544 > 82.147.133.140.https: UDP, length 38
13:46:02.997729 IP 192.168.0.101.34544 > 82.147.133.140.https: UDP, length 38
13:46:02.999000 IP 82.147.133.140.https > 192.168.0.101.34544: UDP, length 1350
13:46:02.999009 IP 82.147.133.140.https > 192.168.0.101.34544: UDP, length 1350
13:46:02.999011 IP 82.147.133.140.https > 192.168.0.101.34544: UDP, length 1350
13:46:02.999012 IP 82.147.133.140.https > 192.168.0.101.34544: UDP, length 1350
13:46:02.999014 IP 82.147.133.140.https > 192.168.0.101.34544: UDP, length 1350
13:46:02.999016 IP 82.147.133.140.https > 192.168.0.101.34544: UDP, length 1350
13:46:02.999018 IP 82.147.133.140.https > 192.168.0.101.34544: UDP, length 1350
13:46:02.999021 IP 82.147.133.140.https > 192.168.0.101.34544: UDP, length 1350
13:46:02.999026 IP 82.147.133.140.https > 192.168.0.101.34544: UDP, length 848
13:46:02.999104 IP 192.168.0.101.34544 > 82.147.133.140.https: UDP, length 38
13:46:02.999150 IP 192.168.0.101.34544 > 82.147.133.140.https: UDP, length 38
13:46:02.999181 IP 192.168.0.101.34544 > 82.147.133.140.https: UDP, length 38
13:46:02.999209 IP 192.168.0.101.34544 > 82.147.133.140.https: UDP, length 38
13:46:02.999237 IP 192.168.0.101.34544 > 82.147.133.140.https: UDP, length 38
13:46:03.005566 IP 192.168.0.1.domain > 192.168.0.101.60814: 41535 1/6/12 PTR sof01s12-in-f2.1e100.net. (457)
13:46:03.005714 IP 192.168.0.101.50466 > 192.168.0.1.domain: 49750+ PTR? 142.133.147.82.in-addr.arpa. (45)
13:46:03.006171 IP 192.168.0.101.34730 > sof01s12-in-f2.1e100.net.https: UDP, length 1350
13:46:03.006492 IP 192.168.0.101.34730 > sof01s12-in-f2.1e100.net.https: UDP, length 1350
13:46:03.006514 IP 192.168.0.101.34730 > sof01s12-in-f2.1e100.net.https: UDP, length 968
13:46:03.007062 IP 192.168.0.101.38278 > 192.168.0.1.domain: 29068+ A? securepubads.g.doubleclick.net. (48)
13:46:03.007794 IP 192.168.0.101.49116 > sof02s18-in-f2.1e100.net.https: UDP, length 174
13:46:03.009398 IP 192.168.0.101.34544 > 82.147.133.140.https: UDP, length 599
13:46:03.009456 IP 192.168.0.101.49697 > sof02s17-in-f14.1e100.net.https: UDP, length 38
13:46:03.013389 IP 82.147.133.140.https > 192.168.0.101.34544: UDP, length 98
13:46:03.013398 IP 192.168.0.1.domain > 192.168.0.101.50466: 49750 NXDomain 0/1/0 (99)
13:46:03.013405 IP 192.168.0.1.domain > 192.168.0.101.38278: 29068 2/4/4 CNAME partnerad.l.doubleclick.net., A 216.58.212.34 (236)
13:46:03.013500 IP 192.168.0.101.49182 > 192.168.0.1.domain: 45226+ PTR? 232.153.194.173.in-addr.arpa. (46)
13:46:03.013651 IP sof01s12-in-f2.1e100.net.https > 192.168.0.101.34730: UDP, length 1350
13:46:03.013657 IP sof01s12-in-f2.1e100.net.https > 192.168.0.101.34730: UDP, length 30
13:46:03.014530 IP 192.168.0.101.35331 > sof02s18-in-f2.1e100.net.https: UDP, length 1350
13:46:03.014946 IP 192.168.0.101.35331 > sof02s18-in-f2.1e100.net.https: UDP, length 495
13:46:03.015050 IP sof02s18-in-f14.1e100.net.https > 192.168.0.101.51890: UDP, length 1350
13:46:03.015504 IP sof02s18-in-f14.1e100.net.https > 192.168.0.101.51890: UDP, length 1350
13:46:03.015511 IP sof02s18-in-f14.1e100.net.https > 192.168.0.101.51890: UDP, length 1350
13:46:03.015516 IP sof02s18-in-f14.1e100.net.https > 192.168.0.101.51890: UDP, length 1350
13:46:03.015558 IP 192.168.0.101.51890 > sof02s18-in-f14.1e100.net.https: UDP, length 44
13:46:03.015591 IP 192.168.0.101.51890 > sof02s18-in-f14.1e100.net.https: UDP, length 38
13:46:03.016332 IP sof02s18-in-f14.1e100.net.https > 192.168.0.101.51890: UDP, length 1350
13:46:03.016337 IP sof02s18-in-f14.1e100.net.https > 192.168.0.101.51890: UDP, length 1350
13:46:03.016339 IP sof02s18-in-f14.1e100.net.https > 192.168.0.101.51890: UDP, length 1350
13:46:03.016341 IP sof02s18-in-f14.1e100.net.https > 192.168.0.101.51890: UDP, length 1350
